{
  "source_schema_version": 1,
  "split": "heldout",
  "learning_allowed": false,
  "sources": [
    {
      "source_id": "gutenberg_844",
      "domain": "public_domain_drama",
      "title": "The Importance of Being Earnest: A Trivial Comedy for Serious People",
      "creator": "Oscar Wilde",
      "publication_year": 1895,
      "source_url": "https://www.gutenberg.org/ebooks/844",
      "source_download_url": "https://www.gutenberg.org/cache/epub/844/pg844.txt",
      "authoritative_source_url": "https://www.gutenberg.org/ebooks/844",
      "license_name": "Public Domain in the USA",
      "license_url": "https://www.gutenberg.org/policy/license.html",
      "provenance_evidence_url": "https://www.gutenberg.org/ebooks/844",
      "retrieval_date": "2026-09-04",
      "raw_source_sha256": "1b8a58099bb1cdef6a845277a4bacf2f4a268702c165bde30124d4b5105d1851",
      "rights_note": "The play was first published in 1895. Project Gutenberg ebook #844 states that it is usable in the United States at no cost and with almost no restrictions; readers outside the United States must check local law.",
      "extraction_method": "Manual selection of bounded, contiguous ten-turn dialogue excerpts from the Project Gutenberg UTF-8 plain-text edition of ebook #844, retrieved 2026-09-04. Source line wrapping was normalized to spaces; dialogue wording, punctuation, emphasis markers, and inline stage directions were otherwise preserved.",
      "extraction_locator_schema": "act plus Project Gutenberg plain-text line range",
      "extractor_version": "manual-contiguous-dialogue-v1",
      "annotation_method": "literary_weak_supervision_v1",
      "supervision_level": "weak",
      "outcome_evidence": "literary_counterfactual_weak_supervision",
      "is_real_human": false,
      "is_public_domain": true,
      "training_eligible": false,
      "teacher_replay_eligible": false
    }
  ],
  "conversations": [
    {
      "source_conversation_id": "gutenberg_844_act_1_music_and_champagne",
      "source_id": "gutenberg_844",
      "relationship_context": "An aristocratic bachelor and his manservant discuss piano playing, refreshments, and household champagne.",
      "participants": [
        "ALGERNON",
        "LANE"
      ],
      "turns": [
        {
          "speaker": "ALGERNON",
          "addressee": "LANE",
          "text": "Did you hear what I was playing, Lane?",
          "source_locator": "Act I, Project Gutenberg plain-text lines 90-91"
        },
        {
          "speaker": "LANE",
          "addressee": "ALGERNON",
          "text": "I didn’t think it polite to listen, sir.",
          "source_locator": "Act I, Project Gutenberg plain-text lines 93-94"
        },
        {
          "speaker": "ALGERNON",
          "addressee": "LANE",
          "text": "I’m sorry for that, for your sake. I don’t play accurately—any one can play accurately—but I play with wonderful expression. As far as the piano is concerned, sentiment is my forte. I keep science for Life.",
          "source_locator": "Act I, Project Gutenberg plain-text lines 96-99"
        },
        {
          "speaker": "LANE",
          "addressee": "ALGERNON",
          "text": "Yes, sir.",
          "source_locator": "Act I, Project Gutenberg plain-text lines 101-102"
        },
        {
          "speaker": "ALGERNON",
          "addressee": "LANE",
          "text": "And, speaking of the science of Life, have you got the cucumber sandwiches cut for Lady Bracknell?",
          "source_locator": "Act I, Project Gutenberg plain-text lines 104-106"
        },
        {
          "speaker": "LANE",
          "addressee": "ALGERNON",
          "text": "Yes, sir. [Hands them on a salver.]",
          "source_locator": "Act I, Project Gutenberg plain-text lines 108-109"
        },
        {
          "speaker": "ALGERNON",
          "addressee": "LANE",
          "text": "[Inspects them, takes two, and sits down on the sofa.] Oh! . . . by the way, Lane, I see from your book that on Thursday night, when Lord Shoreman and Mr. Worthing were dining with me, eight bottles of champagne are entered as having been consumed.",
          "source_locator": "Act I, Project Gutenberg plain-text lines 111-115"
        },
        {
          "speaker": "LANE",
          "addressee": "ALGERNON",
          "text": "Yes, sir; eight bottles and a pint.",
          "source_locator": "Act I, Project Gutenberg plain-text lines 117-118"
        },
        {
          "speaker": "ALGERNON",
          "addressee": "LANE",
          "text": "Why is it that at a bachelor’s establishment the servants invariably drink the champagne? I ask merely for information.",
          "source_locator": "Act I, Project Gutenberg plain-text lines 120-122"
        },
        {
          "speaker": "LANE",
          "addressee": "ALGERNON",
          "text": "I attribute it to the superior quality of the wine, sir. I have often observed that in married households the champagne is rarely of a first-rate brand.",
          "source_locator": "Act I, Project Gutenberg plain-text lines 124-127"
        }
      ]
    },
    {
      "source_conversation_id": "gutenberg_844_act_1_town_and_country",
      "source_id": "gutenberg_844",
      "relationship_context": "Two close friends banter about town, country life, and disagreeable neighbors.",
      "participants": [
        "ALGERNON",
        "JACK"
      ],
      "turns": [
        {
          "speaker": "ALGERNON",
          "addressee": "JACK",
          "text": "How are you, my dear Ernest? What brings you up to town?",
          "source_locator": "Act I, Project Gutenberg plain-text lines 166-167"
        },
        {
          "speaker": "JACK",
          "addressee": "ALGERNON",
          "text": "Oh, pleasure, pleasure! What else should bring one anywhere? Eating as usual, I see, Algy!",
          "source_locator": "Act I, Project Gutenberg plain-text lines 169-171"
        },
        {
          "speaker": "ALGERNON",
          "addressee": "JACK",
          "text": "[Stiffly_._] I believe it is customary in good society to take some slight refreshment at five o’clock. Where have you been since last Thursday?",
          "source_locator": "Act I, Project Gutenberg plain-text lines 173-176"
        },
        {
          "speaker": "JACK",
          "addressee": "ALGERNON",
          "text": "[Sitting down on the sofa.] In the country.",
          "source_locator": "Act I, Project Gutenberg plain-text lines 178-179"
        },
        {
          "speaker": "ALGERNON",
          "addressee": "JACK",
          "text": "What on earth do you do there?",
          "source_locator": "Act I, Project Gutenberg plain-text lines 181-182"
        },
        {
          "speaker": "JACK",
          "addressee": "ALGERNON",
          "text": "[Pulling off his gloves_._] When one is in town one amuses oneself. When one is in the country one amuses other people. It is excessively boring.",
          "source_locator": "Act I, Project Gutenberg plain-text lines 184-187"
        },
        {
          "speaker": "ALGERNON",
          "addressee": "JACK",
          "text": "And who are the people you amuse?",
          "source_locator": "Act I, Project Gutenberg plain-text lines 189-190"
        },
        {
          "speaker": "JACK",
          "addressee": "ALGERNON",
          "text": "[Airily_._] Oh, neighbours, neighbours.",
          "source_locator": "Act I, Project Gutenberg plain-text lines 192-193"
        },
        {
          "speaker": "ALGERNON",
          "addressee": "JACK",
          "text": "Got nice neighbours in your part of Shropshire?",
          "source_locator": "Act I, Project Gutenberg plain-text lines 195-196"
        },
        {
          "speaker": "JACK",
          "addressee": "ALGERNON",
          "text": "Perfectly horrid! Never speak to one of them.",
          "source_locator": "Act I, Project Gutenberg plain-text lines 198-199"
        }
      ]
    },
    {
      "source_conversation_id": "gutenberg_844_act_1_jack_courts_gwendolen",
      "source_id": "gutenberg_844",
      "relationship_context": "A suitor tries to declare his love while the woman he courts explains her confidence in his supposed name.",
      "participants": [
        "JACK",
        "GWENDOLEN"
      ],
      "turns": [
        {
          "speaker": "JACK",
          "addressee": "GWENDOLEN",
          "text": "Charming day it has been, Miss Fairfax.",
          "source_locator": "Act I, Project Gutenberg plain-text lines 707-708"
        },
        {
          "speaker": "GWENDOLEN",
          "addressee": "JACK",
          "text": "Pray don’t talk to me about the weather, Mr. Worthing. Whenever people talk to me about the weather, I always feel quite certain that they mean something else. And that makes me so nervous.",
          "source_locator": "Act I, Project Gutenberg plain-text lines 710-713"
        },
        {
          "speaker": "JACK",
          "addressee": "GWENDOLEN",
          "text": "I _do_ mean something else.",
          "source_locator": "Act I, Project Gutenberg plain-text lines 715-716"
        },
        {
          "speaker": "GWENDOLEN",
          "addressee": "JACK",
          "text": "I thought so. In fact, I am never wrong.",
          "source_locator": "Act I, Project Gutenberg plain-text lines 718-719"
        },
        {
          "speaker": "JACK",
          "addressee": "GWENDOLEN",
          "text": "And I would like to be allowed to take advantage of Lady Bracknell’s temporary absence . . .",
          "source_locator": "Act I, Project Gutenberg plain-text lines 721-723"
        },
        {
          "speaker": "GWENDOLEN",
          "addressee": "JACK",
          "text": "I would certainly advise you to do so. Mamma has a way of coming back suddenly into a room that I have often had to speak to her about.",
          "source_locator": "Act I, Project Gutenberg plain-text lines 725-727"
        },
        {